{
  "$id": "EOEjCWfZ-zRXj3E7zw0tA2Cgwmr6skydVTBsNZSgx3DX",
  "$schema": "https://json-schema.org/draft/2020-12/schema",
  "title": "A2P Campaign Credential",
  "description": "A credential issued to a brand that represents a registered A2P messaging campaign and the telephone numbers associated with that campaign.",
  "type": "object",
  "version": "2.0.0",
  "required": [
    "v",
    "d",
    "i",
    "ri",
    "s",
    "a",
    "r"
  ],
  "properties": {
    "v": {
      "description": "Version string using ACDC conventions, encoding protocol, serialization, and size.",
      "type": "string",
      "pattern": "^ACDC[0-9]{2}[A-Z]{4}[0-9a-f]{6}_$",
      "examples": [
        "ACDC10JSON0005c8_"
      ]
    },
    "d": {
      "description": "SAID of the credential (Blake3-256 digest in CESR compact encoding).",
      "type": "string",
      "pattern": "^E[A-Za-z0-9_-]{43}$",
      "examples": [
        "EBwNam2e0mYdTx0i9xv78AIm16g1XCkQO8f8yJXaxmJC"
      ]
    },
    "u": {
      "description": "A salty nonce (high-entropy random value) used to prevent rainbow-table attacks on the credential SAID.",
      "type": "string",
      "examples": [
        "0AHcgNghkDaG7ts1Bv8wkv3b"
      ]
    },
    "i": {
      "description": "AID of the issuer (the party asserting the campaign).",
      "type": "string",
      "pattern": "^[A-Za-z0-9_-]{44}$",
      "examples": [
        "EDC0Sj0CPYd70zUSY2ehvm7Z4kwZigugiA84wuS7lK2H",
        "BCmx-dBiozRlK5MfRnznAHl9kmXjB3t-zxrE3hIIYkeS"
      ]
    },
    "ri": {
      "description": "SAID of the issuer's ACDC credential status registry.",
      "type": "string",
      "pattern": "^E[A-Za-z0-9_-]{43}$",
      "examples": [
        "EiySMSMLRrpt9AD_b34VEtUD6tDO0yaGoWCwB1iyJOgY"
      ]
    },
    "s": {
      "description": "SAID of this schema (Blake3-256 digest in CESR compact encoding).",
      "type": "string",
      "pattern": "^E[A-Za-z0-9_-]{43}$",
      "examples": [
        "EFtg-VSIdmBRAH2bNMIkfuAyNShqN8volGPsl5ZQZbTp"
      ]
    },
    "a": {
      "oneOf": [
        {
          "description": "SAID of attributes block.",
          "type": "string",
          "pattern": "^E[A-Za-z0-9_-]{43}$",
          "examples": [
            "EAS6jFIgA_WqWEIX6bQTi6Hvdox3GuyRbDKY8JCEfyZG"
          ]
        },
        {
          "$id": "EJ5RQYKsSV9FI8O-qDDxCBinDuQfpdmlFeQ6e0lP0XdV",
          "description": "Attributes block",
          "type": "object",
          "required": [
            "d",
            "i",
            "dt",
            "brandId",
            "campaignId",
            "usecase",
            "authorizedServiceProvider"
          ],
          "properties": {
            "d": {
              "description": "SAID of the attributes block (Blake3-256 digest in CESR compact encoding).",
              "type": "string",
              "pattern": "^E[A-Za-z0-9_-]{43}$",
              "examples": [
                "EAS6jFIgA_WqWEIX6bQTi6Hvdox3GuyRbDKY8JCEfyZG"
              ]
            },
            "u": {
              "description": "A salty nonce for the attributes block, enabling selective disclosure.",
              "type": "string",
              "examples": [
                "0AHcgNghkDaG7ts1Bv8wkv3b"
              ]
            },
            "i": {
              "description": "AID of the organization approved to originate traffic for this campaign.",
              "type": "string",
              "pattern": "^[A-Za-z0-9_-]{44}$",
              "examples": [
                "EK2r6EnDXre2pecTBO8s99j4OtNaaDIhVyr7uGugDhmp"
              ]
            },
            "dt": {
              "description": "Issuance date-time (when the ACDC was signed), as an ISO-8601 datetime string with timezone.",
              "type": "string",
              "format": "date-time",
              "examples": [
                "2024-11-13T20:20:39.000000+00:00"
              ]
            },
            "brandId": {
              "description": "Legal identifier for the organization approved for the campaign -- e.g., an LEI, ISIN code, S&P company ID, DUNS number, etc.",
              "type": "string",
              "minLength": 2,
              "maxLength": 64,
              "examples": [
                "5493001KJTIIGC8Y1R12"
              ]
            },
            "campaignId": {
              "description": "Unique campaign identifier assigned by the campaign approval authority or registry.",
              "type": "string",
              "minLength": 3,
              "maxLength": 32,
              "examples": [
                "CVN1LXI"
              ]
            },
            "usecase": {
              "description": "Campaign use case category. Values should align with the applicable campaign registry or governance framework.",
              "type": "string",
              "examples": [
                "2FA",
                "Account Notification",
                "Customer Care",
                "Delivery Notification",
                "Fraud Alert",
                "Higher Education",
                "Marketing",
                "Public Service Announcement",
                "Security Alert"
              ]
            },
            "startDate": {
              "description": "Campaign start date-time, as an ISO-8601 datetime string with timezone.",
              "type": "string",
              "format": "date-time",
              "examples": [
                "2024-11-13T20:20:39.000000+00:00"
              ]
            },
            "endDate": {
              "description": "Campaign expiration date-time, as an ISO-8601 datetime string with timezone.",
              "type": "string",
              "format": "date-time",
              "examples": [
                "2025-11-13T20:20:39.000000+00:00"
              ]
            },
            "numbers": {
              "description": "Array of number expressions representing telephone numbers allocated to the brand. Each expression is either a single E164 number (e.g., '+15551234567') or an inclusive range denoted by a hyphen between two E164 numbers (e.g., '+15551230000-+15551239999').",
              "type": "array",
              "uniqueItems": true,
              "minItems": 1,
              "items": {
                "type": "string",
                "description": "A single E164 telephone number or an inclusive range. Single number: '+' followed by 7-15 digits. Range: two E164 numbers separated by a hyphen (e.g., '+15551230000-+15551239999').",
                "pattern": "^\\+[0-9]{7,15}(-\\+[0-9]{7,15})?$"
              },
              "examples": [
                [
                  "+15551234567"
                ],
                [
                  "+15551230000-+15551239999"
                ],
                [
                  "+15551234567",
                  "+442071234567"
                ],
                [
                  "+15551230000-+15551239999",
                  "+15558880000-+15558889999"
                ],
                [
                  "+15551234567",
                  "+15559876543",
                  "+442071234567",
                  "+81312345678"
                ]
              ]
            },
            "authorizedServiceProvider": {
              "description": "Service provider authorized to originate or manage traffic for this campaign.",
              "type": "string",
              "minLength": 2,
              "maxLength": 64,
              "examples": [
                "Twilio"
              ]
            },
            "campaignAttributes": {
              "description": "Campaign and content attributes used to evaluate the campaign under the applicable governance framework.",
              "type": "object",
              "required": [
                "subscriberOptIn",
                "subscriberOptOut"
              ],
              "properties": {
                "subscriberOptIn": {
                  "description": "Whether the campaign collects and processes subscriber opt-ins.",
                  "type": "boolean",
                  "examples": [
                    true
                  ]
                },
                "subscriberOptOut": {
                  "description": "Whether the campaign collects and processes subscriber opt-outs.",
                  "type": "boolean",
                  "examples": [
                    true
                  ]
                },
                "subscriberHelp": {
                  "description": "Whether subscribers can contact the sender after sending the HELP keyword or equivalent support request.",
                  "type": "boolean",
                  "examples": [
                    true
                  ]
                },
                "embeddedLink": {
                  "description": "Whether campaign messages may contain embedded links.",
                  "type": "boolean",
                  "examples": [
                    false
                  ]
                },
                "affiliateMarketing": {
                  "description": "Whether the campaign involves affiliate marketing.",
                  "type": "boolean",
                  "examples": [
                    false
                  ]
                }
              },
              "additionalProperties": true
            }
          },
          "additionalProperties": true
        }
      ]
    },
    "e": {
      "oneOf": [
        {
          "description": "SAID of edges block.",
          "type": "string",
          "pattern": "^E[A-Za-z0-9_-]{43}$",
          "examples": [
            "EOS9BUu6iHS6QaTADgHWcWG36tsKYY3g_z3nCkrnbBMr"
          ]
        },
        {
          "$id": "EIbjJoN5r0zoAj3Z6-Pv-qHi77lsRb2cf6GDg6lT9gbq",
          "description": "Edges block",
          "type": "object",
          "required": [
            "d"
          ],
          "properties": {
            "d": {
              "description": "SAID of the edges block (Blake3-256 digest in CESR compact encoding).",
              "type": "string",
              "pattern": "^E[A-Za-z0-9_-]{43}$",
              "examples": [
                "EOS9BUu6iHS6QaTADgHWcWG36tsKYY3g_z3nCkrnbBMr"
              ]
            },
            "issuer": {
              "description": "Edge credential that proves the identity of the issuer.",
              "type": "object",
              "properties": {
                "n": {
                  "description": "SAID of a credential that proves the identity of the issuer.",
                  "type": "string",
                  "pattern": "^E[A-Za-z0-9_-]{43}$",
                  "examples": [
                    "EBwNam2e0mYdTx0i9xv78AIm16g1XCkQO8f8yJXaxmJC"
                  ]
                },
                "s": {
                  "description": "SAID of the schema that the issuer identity credential must satisfy.",
                  "type": "string",
                  "pattern": "^E[A-Za-z0-9_-]{43}$",
                  "examples": [
                    "ENPE4hUQ8Peu84tEcCni3koOQFOnBrDB0rg_at2NRhV9"
                  ]
                },
                "o": {
                  "description": "Edge operator. I2I: issuer AID must be the issuee AID of the far node. NI2I: no such requirement. DI2I: delegated issuer AID must be issuee AID of the far node. NOT: inverts the validity of the edge.",
                  "type": "string",
                  "default": "I2I",
                  "enum": [
                    "I2I",
                    "NI2I",
                    "DI2I",
                    "NOT"
                  ]
                }
              },
              "additionalProperties": false,
              "required": [
                "n",
                "s",
                "o"
              ]
            },
            "tnalloc": {
              "description": "Chain to a Telephone Number Allocation credential proving right to use the campaign telephone numbers.",
              "type": "object",
              "required": [
                "n",
                "s",
                "o"
              ],
              "properties": {
                "n": {
                  "description": "SAID of the Telephone Number Allocation credential.",
                  "type": "string",
                  "pattern": "^E[A-Za-z0-9_-]{43}$",
                  "examples": [
                    "EBwNam2e0mYdTx0i9xv78AIm16g1XCkQO8f8yJXaxmJC"
                  ]
                },
                "s": {
                  "description": "SAID of the Telephone Number Allocation schema.",
                  "type": "string",
                  "pattern": "^E[A-Za-z0-9_-]{43}$",
                  "examples": [
                    "EJ9YoTJ81TcQ_pS9GmU2UbVURRm3ylnx_Wr1GbKjg0QP"
                  ]
                },
                "o": {
                  "description": "Edge operator. I2I: issuer AID must be the issuee AID of the far node. NI2I: no such requirement. DI2I: delegated issuer AID must be issuee AID of the far node. NOT: inverts the validity of the edge.",
                  "type": "string",
                  "default": "NI2I",
                  "enum": [
                    "I2I",
                    "NI2I",
                    "DI2I",
                    "NOT"
                  ]
                }
              },
              "additionalProperties": false
            },
            "brandid": {
              "description": "Chain to a credential that identifies the brand or organization associated with this campaign.",
              "type": "object",
              "properties": {
                "n": {
                  "description": "SAID of a credential that proves the brand identity.",
                  "type": "string",
                  "pattern": "^E[A-Za-z0-9_-]{43}$",
                  "examples": [
                    "EBwNam2e0mYdTx0i9xv78AIm16g1XCkQO8f8yJXaxmJC"
                  ]
                },
                "s": {
                  "description": "SAID of the schema that the brand identity credential must satisfy.",
                  "type": "string",
                  "pattern": "^E[A-Za-z0-9_-]{43}$",
                  "examples": [
                    "EAoRVmgPyacjhUxaV0nPwiuUuHMjKDpNZrj7ClofZ-3Z"
                  ]
                },
                "o": {
                  "description": "Edge operator. I2I: issuer AID must be the issuee AID of the far node. NI2I: no such requirement. DI2I: delegated issuer AID must be issuee AID of the far node. NOT: inverts the validity of the edge.",
                  "type": "string",
                  "default": "NI2I",
                  "enum": [
                    "I2I",
                    "NI2I",
                    "DI2I",
                    "NOT"
                  ]
                }
              },
              "additionalProperties": false,
              "required": [
                "n",
                "s",
                "o"
              ]
            }
          },
          "additionalProperties": true
        }
      ]
    },
    "r": {
      "oneOf": [
        {
          "description": "SAID of rules block.",
          "type": "string",
          "pattern": "^E[A-Za-z0-9_-]{43}$",
          "examples": [
            "EMS9_VeDinkCdVlMVJKwbeBrsjnVj8VO1OS0walgg05X"
          ]
        },
        {
          "$id": "EJQM4mXy03inJIDBK-iJEfZWXZkFVrJVsrtFkryYPZH6",
          "description": "Rules detail",
          "type": "object",
          "required": [
            "d",
            "governance"
          ],
          "properties": {
            "d": {
              "description": "SAID of the rules block (Blake3-256 digest in CESR compact encoding).",
              "type": "string",
              "pattern": "^E[A-Za-z0-9_-]{43}$",
              "examples": [
                "EMS9_VeDinkCdVlMVJKwbeBrsjnVj8VO1OS0walgg05X"
              ]
            },
            "governance": {
              "description": "Statement identifying the governance framework under which this credential was issued.",
              "type": "string",
              "examples": [
                "Issued under governance published at https://provenant.net/governance/a2p-campaign/"
              ]
            },
            "brandPrivacy": {
              "description": "Brand Privacy Disclaimer",
              "oneOf": [
                {
                  "description": "simple compact rule form",
                  "type": "string",
                  "const": "Verifiers agree that, if they learn the identity of a brand as a sender of SMS messages by verifying this credential, they will not use this information to infer or model relationships between the brand and service providers."
                },
                {
                  "description": "Rule detail",
                  "type": "object",
                  "required": [
                    "l"
                  ],
                  "properties": {
                    "l": {
                      "description": "Associated legal language",
                      "type": "string",
                      "const": "Verifiers agree that, if they learn the identity of a brand as a sender of SMS messages by verifying this credential, they will not use this information to infer or model relationships between the brand and service providers.",
                      "examples": [
                        "Verifiers agree that, if they learn the identity of a brand as a sender of SMS messages by verifying this credential, they will not use this information to infer or model relationships between the brand and service providers."
                      ]
                    }
                  },
                  "additionalProperties": false
                }
              ]
            },
            "nonrepudiableBySig": {
              "description": "Non-repudiable Disclaimer",
              "oneOf": [
                {
                  "description": "simple compact rule form",
                  "type": "string",
                  "const": "Senders of SMS messages agree that their reputation as a sender may be non-repudiably associated with messages that cite this campaign, exactly and only to the extent that the messages are signed by an entity cryptographically authorized to represent the brand."
                },
                {
                  "description": "Rule detail",
                  "type": "object",
                  "required": [
                    "l"
                  ],
                  "properties": {
                    "l": {
                      "description": "Associated legal language",
                      "type": "string",
                      "const": "Senders of SMS messages agree that their reputation as a sender may be non-repudiably associated with messages that cite this campaign, exactly and only to the extent that the messages are signed by an entity cryptographically authorized to represent the brand.",
                      "examples": [
                        "Senders of SMS messages agree that their reputation as a sender may be non-repudiably associated with messages that cite this campaign, exactly and only to the extent that the messages are signed by an entity cryptographically authorized to represent the brand."
                      ]
                    }
                  },
                  "additionalProperties": false
                }
              ]
            }
          },
          "additionalProperties": true
        }
      ]
    }
  },
  "additionalProperties": false
}